"title","location","job_url"
"Senior Civil Engineer","McKinney, TX, US","https://www.indeed.com/viewjob?jk=98362e6382dd2710"
"Advanced Manufacturing Engineering Co-Op - Fall 2024","McKinney, TX, US","https://www.indeed.com/viewjob?jk=fb760346fdcd20be"
"Studio Product Photographer","Mansfield, TX, US","https://www.indeed.com/viewjob?jk=20b8065c08d978f3"
"PROCESS ENGINEER","Alvarado, TX, US","https://www.indeed.com/viewjob?jk=9fd9a450285958b8"
"Mixed Signal Wafer Test Engineer","Richardson, TX, US","https://www.indeed.com/viewjob?jk=8ded7c1c574d5ca3"
"Navigation and Guidance Engineer","Fort Worth, TX, US","https://www.indeed.com/viewjob?jk=925ac2c517dd10ef"
"Civil Land Engineering Manager","Forney, TX, US","https://www.indeed.com/viewjob?jk=707ff67f6a6e3337"
"Mobile Device Post Market Data Analysis","Plano, TX, US","https://www.indeed.com/viewjob?jk=086fa784629a9220"
"R&D Mechanical Engineer, Prin","Carrollton, TX, US","https://www.indeed.com/viewjob?jk=c1f4343662a927d2"
"R&D Engineer I","Allen, TX, US","https://www.indeed.com/viewjob?jk=0cdf710aecfd6427"
"Electrical Engineer","Dallas, TX, US","https://www.indeed.com/viewjob?jk=c905caff2d8a1492"
"Communication Systems Design Engineer- Secret Clearance- Ft. Worth, Tx","Fort Worth, TX, US","https://www.indeed.com/viewjob?jk=c82aed787b9caa52"
"Senior Field Applications Engineer","Dallas, TX, US","https://www.indeed.com/viewjob?jk=60ba8975a125de06"
"Senior Electrical Engineer","Dallas, TX, US","https://www.indeed.com/viewjob?jk=45e9d85c560d5dd0"
"Corporate Process Controls/ Automation Engineer -...","Dallas, TX, US","https://www.indeed.com/viewjob?jk=7485da15929fe98d"
